Title,Flair,Date Created,Upvotes,Upvote Ratio,ID,Edited?,Is Locked?,NSFW?,Is Spoiler?,Stickied?,URL,Comment Count,TextPepe the Frog is your Meme of the Decade,,01-30-2020 23:01:08,120486,0.87,ew6oev,False,False,False,False,True,https://i.imgur.com/iZl9NyW.jpg,2742,Please leave me alone,Mods Choice,02-08-2020 19:44:44,68960,0.97,f0qkle,False,False,False,False,False,https://i.redd.it/837n8k8ptof41.jpg,211,Not stonks.,It really do be that way 😐 ,02-08-2020 21:19:48,19051,0.96,f0rh5a,False,False,False,False,False,https://i.redd.it/4jtirhjpapf41.jpg,54,If there is a way to get google dark mode please tell me,immapeeinurass,02-08-2020 21:27:12,18495,0.96,f0rjzk,False,False,False,False,False,https://i.redd.it/rfkakn31cpf41.jpg,349,*queen noises*,was is the because is was is the was,02-08-2020 22:01:48,9653,0.97,f0rxum,False,False,False,False,False,https://i.redd.it/firrd6c7ipf41.jpg,68,I can relate,based on a true story,02-08-2020 16:56:31,53269,0.93,f0p4t6,False,False,False,False,False,https://i.redd.it/u85qxcjqznf41.jpg,153,Woof,,02-08-2020 19:57:16,16290,0.94,f0qoly,False,False,False,False,False,https://i.redd.it/s8r95hhzvof41.jpg,37,"Cracking Cheese, Gromit!",This will 100% get deleted,02-08-2020 21:44:37,5946,0.99,f0rqxa,False,False,False,False,False,https://i.redd.it/m0eyph05fpf41.jpg,30,This happens a lot more often than you’d think,was is the because is was is the was,02-08-2020 17:35:15,38664,0.95,f0pgfq,False,False,False,False,False,https://i.redd.it/yt7jbe1n6of41.jpg,147,Explanations are a bit inaccurate but you get the point,,02-08-2020 20:15:36,10668,0.99,f0quu5,False,False,False,False,False,https://i.redd.it/qjmqq2m5zof41.png,52,